{
  "meta": {
    "accent": "#2563eb",
    "mode": "light",
    "density": "normal",
    "ratio": 1.125,
    "version": "1.0.0",
    "generator": "ui-style-craft"
  },
  "color": {
    "neutral": {
      "50": "#f9f9fb",
      "100": "#f3f4f7",
      "200": "#eaecf0",
      "300": "#d9dce3",
      "400": "#b2b9c7",
      "500": "#8d98b0",
      "600": "#697796",
      "700": "#4e5a74",
      "800": "#343f55",
      "900": "#1e2638",
      "950": "#13161b"
    },
    "semantic": {
      "bg": "#f9f9fb",
      "surface": "#ffffff",
      "surface-2": "#f3f4f7",
      "border": "#eaecf0",
      "text-primary": "#1e2638",
      "text-secondary": "#4e5a74",
      "text-muted": "#4e5a74",
      "primary": "#2563eb",
      "primary-fg": "#ffffff",
      "success": "#16a34a",
      "warning": "#d97706",
      "danger": "#dc2626",
      "info": "#0891b2"
    }
  },
  "font": {
    "family": {
      "sans": "Geist, Satoshi, system-ui, sans-serif",
      "mono": "Geist Mono, JetBrains Mono, monospace"
    },
    "size": {
      "xs": "0.79rem",
      "sm": "0.889rem",
      "base": "1rem",
      "lg": "1.125rem",
      "xl": "1.266rem",
      "2xl": "1.424rem",
      "3xl": "1.602rem",
      "4xl": "1.802rem",
      "5xl": "2.027rem",
      "6xl": "2.281rem"
    },
    "weight": {
      "regular": "400",
      "medium": "500",
      "semibold": "600",
      "bold": "700"
    },
    "lineHeight": {
      "tight": "1.15",
      "normal": "1.5",
      "relaxed": "1.625"
    },
    "letterSpacing": {
      "tighter": "-0.02em",
      "normal": "0",
      "wide": "0.025em"
    }
  },
  "space": {
    "0": "0",
    "1": "4px",
    "2": "8px",
    "3": "12px",
    "4": "16px",
    "5": "20px",
    "6": "24px",
    "8": "32px",
    "10": "40px",
    "12": "48px",
    "16": "64px",
    "20": "80px"
  },
  "spaceAlias": {
    "xs": "{space.1}",
    "sm": "{space.2}",
    "md": "{space.4}",
    "lg": "{space.6}",
    "xl": "{space.8}",
    "2xl": "{space.12}"
  },
  "radius": {
    "none": "0",
    "sm": "4px",
    "md": "8px",
    "lg": "12px",
    "xl": "16px",
    "2xl": "24px",
    "full": "9999px"
  },
  "shadow": {
    "sm": "0 1px 2px 0 rgba(34, 42, 57, 0.05)",
    "md": "0 4px 6px -1px rgba(34, 42, 57, 0.07), 0 2px 4px -2px rgba(34, 42, 57, 0.05)",
    "lg": "0 10px 15px -3px rgba(34, 42, 57, 0.08), 0 4px 6px -4px rgba(34, 42, 57, 0.05)",
    "xl": "0 20px 25px -5px rgba(34, 42, 57, 0.1), 0 8px 10px -6px rgba(34, 42, 57, 0.05)"
  },
  "motion": {
    "duration": {
      "instant": "0ms",
      "fast": "150ms",
      "normal": "250ms",
      "slow": "400ms"
    },
    "easing": {
      "standard": "cubic-bezier(0.4,0,0.2,1)",
      "emphasized": "cubic-bezier(0.2,0,0,1)",
      "decelerate": "cubic-bezier(0,0,0.2,1)"
    }
  }
}